{
  "schema": "bao.workflow/v2",
  "version": 2,
  "id": "wf-1792552972403",
  "name": "Captured workflow",
  "startUrl": "http://127.0.0.1:4787/fixture",
  "inputs": [
    {
      "name": "username",
      "type": "text",
      "required": true,
      "label": "username",
      "default": "ada"
    },
    {
      "name": "password",
      "type": "secret",
      "required": true,
      "label": "password"
    },
    {
      "name": "file",
      "type": "file",
      "required": true,
      "label": "file"
    },
    {
      "name": "drop",
      "type": "file",
      "required": true,
      "label": "drop"
    }
  ],
  "steps": [
    {
      "id": "wf-1792552972403-0",
      "index": 0,
      "action": "type",
      "label": "Type {{username}}",
      "surface": "dom",
      "identity": {
        "surface": "dom",
        "role": "input",
        "id": "username",
        "nameAttr": "username",
        "tag": "input",
        "path": []
      },
      "timeoutMs": 8000,
      "input": "username",
      "value": "{{username}}",
      "postcondition": {
        "kind": "value",
        "match": "{{username}}",
        "timeoutMs": 4000
      }
    },
    {
      "id": "wf-1792552972403-1",
      "index": 1,
      "action": "type",
      "label": "Type secret",
      "surface": "dom",
      "identity": {
        "surface": "dom",
        "role": "input",
        "id": "password",
        "nameAttr": "password",
        "tag": "input",
        "path": []
      },
      "timeoutMs": 8000,
      "input": "password",
      "value": "{{password}}",
      "sensitive": true,
      "postcondition": {
        "kind": "element",
        "identity": {
          "surface": "dom",
          "role": "input",
          "id": "password",
          "nameAttr": "password",
          "tag": "input",
          "path": []
        },
        "timeoutMs": 4000
      }
    },
    {
      "id": "wf-1792552972403-2",
      "index": 2,
      "action": "click",
      "label": "Click \"Log in\"",
      "surface": "dom",
      "identity": {
        "surface": "dom",
        "role": "button",
        "testId": "login",
        "id": "login-btn",
        "tag": "button",
        "text": "Log in",
        "path": []
      },
      "timeoutMs": 8000,
      "postcondition": {
        "kind": "url",
        "match": "/secure",
        "timeoutMs": 8000
      }
    },
    {
      "id": "wf-1792552972403-3",
      "index": 3,
      "action": "upload",
      "label": "Upload file",
      "surface": "dom",
      "identity": {
        "surface": "dom",
        "role": "input",
        "testId": "file",
        "id": "file",
        "nameAttr": "file",
        "tag": "input",
        "path": []
      },
      "timeoutMs": 8000,
      "input": "file",
      "value": "{{file}}",
      "postcondition": {
        "kind": "element",
        "identity": {
          "surface": "dom",
          "role": "input",
          "testId": "file",
          "id": "file",
          "nameAttr": "file",
          "tag": "input",
          "path": []
        },
        "timeoutMs": 4000
      }
    },
    {
      "id": "wf-1792552972403-4",
      "index": 4,
      "action": "drop",
      "label": "Drop file",
      "surface": "dom",
      "identity": {
        "surface": "dom",
        "role": "div",
        "testId": "drop",
        "id": "drop",
        "tag": "div",
        "text": "Drop a file here",
        "path": []
      },
      "timeoutMs": 8000,
      "input": "drop",
      "value": "{{drop}}",
      "postcondition": {
        "kind": "element",
        "identity": {
          "surface": "dom",
          "role": "div",
          "testId": "drop",
          "id": "drop",
          "tag": "div",
          "text": "Drop a file here",
          "path": []
        },
        "timeoutMs": 4000
      }
    }
  ],
  "createdAt": 1792552972127
}
