{
  "schema": "bao.workflow/v2",
  "version": 2,
  "id": "wf-live-login",
  "name": "Live model login",
  "startUrl": "https://the-internet.herokuapp.com/login",
  "inputs": [
    {
      "name": "username",
      "type": "text",
      "required": true,
      "label": "username",
      "default": "tomsmith"
    },
    {
      "name": "password",
      "type": "secret",
      "required": true,
      "label": "password"
    }
  ],
  "steps": [
    {
      "id": "wf-live-login-0",
      "index": 0,
      "action": "click",
      "label": "Click",
      "surface": "dom",
      "identity": {
        "surface": "dom",
        "role": "input",
        "id": "username",
        "nameAttr": "username",
        "path": []
      },
      "timeoutMs": 8000,
      "provenance": {
        "x": 361,
        "y": 349,
        "space": "viewport"
      },
      "postcondition": {
        "kind": "element",
        "identity": {
          "surface": "dom",
          "role": "input",
          "id": "username",
          "nameAttr": "username",
          "path": []
        },
        "timeoutMs": 4000
      }
    },
    {
      "id": "wf-live-login-1",
      "index": 1,
      "action": "type",
      "label": "Type {{username}}",
      "surface": "dom",
      "identity": {
        "surface": "dom",
        "role": "input",
        "id": "username",
        "nameAttr": "username",
        "path": []
      },
      "timeoutMs": 8000,
      "input": "username",
      "value": "{{username}}",
      "postcondition": {
        "kind": "value",
        "match": "{{username}}",
        "timeoutMs": 4000
      }
    },
    {
      "id": "wf-live-login-2",
      "index": 2,
      "action": "click",
      "label": "Click",
      "surface": "dom",
      "identity": {
        "surface": "dom",
        "role": "password",
        "id": "password",
        "nameAttr": "password",
        "path": []
      },
      "timeoutMs": 8000,
      "provenance": {
        "x": 361,
        "y": 412,
        "space": "viewport"
      },
      "postcondition": {
        "kind": "element",
        "identity": {
          "surface": "dom",
          "role": "password",
          "id": "password",
          "nameAttr": "password",
          "path": []
        },
        "timeoutMs": 4000
      }
    },
    {
      "id": "wf-live-login-3",
      "index": 3,
      "action": "type",
      "label": "Type secret",
      "surface": "dom",
      "identity": {
        "surface": "dom",
        "role": "password",
        "id": "password",
        "nameAttr": "password",
        "path": []
      },
      "timeoutMs": 8000,
      "input": "password",
      "value": "{{password}}",
      "sensitive": true,
      "postcondition": {
        "kind": "element",
        "identity": {
          "surface": "dom",
          "role": "password",
          "id": "password",
          "nameAttr": "password",
          "path": []
        },
        "timeoutMs": 4000
      }
    },
    {
      "id": "wf-live-login-4",
      "index": 4,
      "action": "click",
      "label": "Click \"Login\"",
      "surface": "dom",
      "identity": {
        "surface": "dom",
        "role": "button",
        "text": "Login",
        "name": "Login",
        "path": []
      },
      "timeoutMs": 8000,
      "provenance": {
        "x": 242,
        "y": 472,
        "space": "viewport"
      },
      "postcondition": {
        "kind": "url",
        "match": "/secure",
        "timeoutMs": 8000
      }
    }
  ],
  "createdAt": 1792552990840
}
